{
  "$schema": "https://json-schema.org/draft/2020-12/schema",
  "$id": "STARWARS_DELTA_CUTSCENE_SCRIPT_V1",
  "title": "STARWARS_DELTA Cutscene Script V1",
  "description": "Backward-compatible semantic cutscene authoring format. ChatGPT authors story, narrative identity, visible evidence, frame-relative composition, semantic actor motion, performance, continuity, closed-world Cutscene projectile selection and legal audio handles. General cast identities use authoritative CURRENT Actor handles. Dialogue participants are the deliberate exception: they use only curated identityHandle values published by EMOTIONAL_DIALOGUE_CURRENT.json. Unity owns CURRENT fingerprints, runtime IDs, exact V3/V5 materialization, camera bounds, launcher/muzzle mechanics, supported runtime motion lowering and final serialization. Semantic motion names do not imply stronger target-relative runtime behavior than the current V5 Timeline supports.",
  "type": "object",
  "additionalProperties": false,
  "required": ["schema", "schemaVersion", "title", "durationSeconds", "beats"],
  "properties": {
    "schema": { "const": "STARWARS_DELTA_CUTSCENE_SCRIPT" },
    "schemaVersion": { "const": 1 },
    "title": { "type": "string", "minLength": 1 },
    "durationSeconds": { "type": "number", "exclusiveMinimum": 0 },
    "creativeIntent": { "type": "string" },
    "cast": {
      "type": "array",
      "items": {
        "type": "object",
        "additionalProperties": false,
        "required": ["id", "identityHandle"],
        "properties": {
          "id": { "type": "string", "pattern": "^[A-Za-z0-9_-]+$", "description": "Narrative identity key. For any cast entry used by dialogue, this value MUST exactly equal that curated Emotional Dialogue character's published actorId. No alias or display-name matching." },
          "identityHandle": { "type": "string", "minLength": 1, "description": "Authoritative CURRENT narrative identity handle. For normal/non-dialogue cast this must be a legal Actor handle. For cast used as dialogue speaker/listener this must be the exact logical identityHandle published for the same actorId in EMOTIONAL_DIALOGUE_CURRENT.json; it is not required to be an Actor Catalog handle and must never be replaced by a portrait/UI handle." },
          "presentationHandle": { "type": "string", "minLength": 1, "description": "Optional CURRENT presentation handle for portrait/body/world evidence. It never creates or changes narrative identity. Dialogue identity remains owned by EMOTIONAL_DIALOGUE_CURRENT.json." },
          "sameIdentityAs": { "type": "string", "pattern": "^[A-Za-z0-9_-]+$" },
          "displayName": { "type": "string" }
        }
      }
    },
    "beats": { "type": "array", "minItems": 1, "items": { "$ref": "#/$defs/beat" } }
  },
  "$defs": {
    "beat": {
      "type": "object",
      "additionalProperties": false,
      "required": ["id", "type"],
      "properties": {
        "id": { "type": "string", "pattern": "^[A-Za-z0-9_-]+$" },
        "type": { "enum": ["establishing", "arrival", "dialogue", "battle", "destruction", "retreat", "celebration", "threat_reveal", "launch", "evacuation", "transition", "custom"] },
        "durationSeconds": { "type": "number", "exclusiveMinimum": 0 },
        "locationHandle": { "type": "string" },
        "storyClaim": { "type": "string" },
        "dramaticFunction": { "enum": ["setup", "build", "reveal", "reaction", "pursuit", "impact", "escape", "climax", "aftermath", "handoff", "release"] },
        "energy": { "enum": ["quiet", "low", "medium", "high", "peak"] },
        "cinematicMove": { "enum": ["establish_location", "hero_in_environment", "ship_flyby", "pullback_reveal", "command_screen_communication", "reaction", "pursuit", "reveal", "launch", "approach", "impact", "escape", "tactical_info", "aftermath", "handoff", "custom"] },
        "visible": { "type": "array", "items": { "$ref": "#/$defs/visibleElement" } },
        "relationships": { "type": "array", "items": { "$ref": "#/$defs/screenRelationship" } },
        "actions": { "type": "array", "items": { "$ref": "#/$defs/action" } },
        "dialogue": { "type": "array", "items": { "$ref": "#/$defs/dialogueLine" } },
        "audio": { "type": "array", "items": { "$ref": "#/$defs/audioCue" } },
        "camera": { "$ref": "#/$defs/camera" },
        "transition": { "$ref": "#/$defs/transition" },
        "continuity": { "$ref": "#/$defs/continuity" },
        "evidence": { "type": "string", "description": "Plain-language visible proof required from the compiled beat." }
      }
    },
    "visibleElement": {
      "type": "object",
      "additionalProperties": false,
      "required": ["id", "handle"],
      "properties": {
        "id": { "type": "string", "pattern": "^[A-Za-z0-9_-]+$" },
        "handle": { "type": "string", "minLength": 1, "description": "Exact legal CURRENT authoring handle. Pixel inspection must determine whether the visual is a reusable single actor or an already-grouped/fleet visual before using count expansion." },
        "count": { "type": "integer", "minimum": 1, "default": 1, "description": "Requested visible instance count. Intended for reusable single-instance visuals or another route explicitly supporting expansion. Do not multiply a precomposed group/fleet visual as though it were one actor." },
        "role": { "type": "string" },
        "state": { "type": "string" },
        "startState": { "type": "string" },
        "endState": { "type": "string" },
        "depth": { "enum": ["far", "background", "mid", "foreground", "ui"] },
        "saliency": { "enum": ["primary", "support", "ambient"] },
        "screenWidthFraction": { "type": "number", "exclusiveMinimum": 0, "maximum": 1.5 },
        "screenHeightFraction": { "type": "number", "exclusiveMinimum": 0, "maximum": 1.5 },
        "screenX": { "type": "number", "minimum": 0, "maximum": 1 },
        "screenY": { "type": "number", "minimum": 0, "maximum": 1 },
        "enterFrom": { "enum": ["left", "right", "top", "bottom", "center", "reveal", "none"] },
        "exitTo": { "enum": ["left", "right", "top", "bottom", "center", "hide", "destroy", "none"] },
        "travelDirection": { "enum": ["left_to_right", "right_to_left", "toward_camera", "away_from_camera", "clockwise", "counterclockwise", "none"] },
        "facing": { "enum": ["left", "right", "toward_target", "away_from_target", "camera", "none"] },
        "performanceIntent": { "type": "string", "description": "Semantic performance intent such as urgent_locomotion, fear, command, injured, relief, resolve, look_up, point or help. Unity resolves legal execution." },
        "animationIntent": { "type": "string", "description": "Semantic animation family intent such as walk, run, interact or hit. Never author raw animation IDs here." }
      }
    },
    "action": {
      "type": "object",
      "additionalProperties": false,
      "required": ["type", "subject"],
      "properties": {
        "type": { "enum": ["enter", "move", "formation", "attack", "fire", "impact", "destroy", "exit", "hide", "reveal", "react", "hold", "darken", "brighten"] },
        "subject": { "type": "string" },
        "target": { "type": "string" },
        "viaHandle": { "type": "string" },
        "effectHandle": { "type": "string", "description": "Exact Effect handle for effect/impact authoring where applicable. Never use effectHandle to carry Cutscene projectile identity." },
        "projectileId": {
          "enum": ["CS_PROJECTILE_BLUE_BOLT", "CS_PROJECTILE_PURPLE_BOLT", "CS_PROJECTILE_POWERBALL"],
          "description": "Exact closed-world Cutscene projectile identity. Required for type=fire Simple V1 actions that lower to VisualWeaponAction. Unsupported explicit IDs block with CUTSCENE_PROJECTILE_NOT_AUTHORING_READY. No gameplay, filename, effectHandle or fuzzy fallback."
        },
        "count": { "type": "integer", "minimum": 1, "description": "For type=fire, maps directly to the VisualWeaponAction / launcher burst count." },
        "motionIntent": { "enum": ["move", "flyby", "approach", "orbit", "intercept", "pass_camera", "bank_away", "pursuit", "escort", "rescue_approach", "formation_break", "landing", "takeoff", "circle_target", "escape", "convoy", "run_to_safety", "gather", "follow", "scatter", "look_up", "help", "enter_shelter"], "description": "Semantic motion request lowered by Unity into existing V5 actorActions. motionIntent=orbit maps to real V5 Actor Orbit. Current Actor Orbit v1 uses a fixed/stationary center and cannot overlap movement of its target/center actor. Pursuit/Escort/Intercept names do not by themselves guarantee per-frame target-relative tracking." },
        "trajectory": { "enum": ["linear", "arc", "curve", "orbit_like", "zigzag", "drift", "screen_parallax"] },
        "travelDirection": { "enum": ["left_to_right", "right_to_left", "toward_camera", "away_from_camera", "clockwise", "counterclockwise", "none"] },
        "speed": { "enum": ["slow", "medium", "fast", "burst"], "description": "Semantic speed value. Unity maps this deterministically; it is not a numeric float literal and must not be parsed directly as one." },
        "performanceIntent": { "type": "string" },
        "animationIntent": { "type": "string" },
        "result": { "type": "string" }
      },
      "allOf": [
        {
          "if": {
            "properties": { "type": { "const": "fire" } },
            "required": ["type"]
          },
          "then": { "required": ["projectileId"] }
        },
        {
          "if": { "required": ["projectileId"] },
          "then": { "properties": { "type": { "const": "fire" } } }
        }
      ]
    },
    "dialogueLine": {
      "type": "object",
      "additionalProperties": false,
      "required": ["speaker", "text"],
      "properties": {
        "speaker": { "type": "string", "pattern": "^[A-Za-z0-9_-]+$", "description": "Exact actorId of an authoringReady Emotional Dialogue character and exact matching cast[].id. No aliases or display-name matching." },
        "listener": { "type": "string", "pattern": "^[A-Za-z0-9_-]+$", "description": "Optional exact actorId of an authoringReady Emotional Dialogue character and exact matching cast[].id. No aliases or display-name matching." },
        "text": { "type": "string", "minLength": 1 },
        "mood": { "type": "string" },
        "expressionIntent": { "type": "string", "description": "Exact published supported expression name for the speaker. If omitted Unity uses that character's published defaultExpression. Unsupported values are blockers; there is no Neutral fallback or filename search." },
        "performanceIntent": { "type": "string" },
        "delivery": { "enum": ["quiet", "normal", "urgent", "command", "reassuring", "warning"] },
        "presentation": { "enum": ["auto", "portrait", "radio", "monitor", "environment"] }
      }
    },
    "audioCue": {
      "type": "object",
      "additionalProperties": false,
      "required": ["kind", "handle"],
      "properties": {
        "kind": { "enum": ["music", "ambience", "sfx"] },
        "handle": { "type": "string", "minLength": 1, "description": "Authoritative CURRENT Audio handle. Never infer from a filename or display name." },
        "operation": { "enum": ["play", "stop", "fade_in", "fade_out"] },
        "intent": { "type": "string" },
        "startOffsetSeconds": { "type": "number", "minimum": 0 },
        "durationSeconds": { "type": "number", "exclusiveMinimum": 0 },
        "loop": { "type": "boolean" },
        "volume": { "type": "number", "minimum": 0, "maximum": 1 },
        "intensity": { "enum": ["low", "medium", "high"] }
      }
    },
    "screenRelationship": {
      "type": "object",
      "additionalProperties": false,
      "required": ["type", "subject", "target"],
      "properties": {
        "type": { "enum": ["left_of", "right_of", "ahead_of", "behind", "faces", "threatens", "follows", "escorts", "protects"] },
        "subject": { "type": "string" },
        "target": { "type": "string" }
      }
    },
    "camera": {
      "type": "object",
      "additionalProperties": false,
      "properties": {
        "framing": { "enum": ["extreme_wide", "wide", "medium", "close", "detail"] },
        "movement": { "enum": ["hold", "push", "pull", "follow", "track", "drift", "shake", "impact_shake", "orbit", "cut"] },
        "subject": { "type": "string", "description": "Semantic composition subject. It is not automatically a physical Transform target. Hold and curated dialogue presentation may preserve this subject while backend physical target remains empty." },
        "direction": { "enum": ["left", "right", "up", "down", "clockwise", "counterclockwise", "toward", "away", "none"] },
        "intensity": { "enum": ["subtle", "medium", "strong"] },
        "parallax": { "enum": ["none", "subtle", "medium", "strong"] },
        "purpose": { "type": "string" }
      },
      "description": "Camera movement is semantic directing intent. camera.movement=orbit is a 2D/2.5D camera/parallax concept and is separate from actor motionIntent=orbit. It must never invent unsupported 3D geometry or viewpoints."
    },
    "transition": {
      "type": "object",
      "additionalProperties": false,
      "required": ["style"],
      "properties": {
        "style": { "enum": ["cut", "crossfade", "fade_to_black", "fade_from_black"] },
        "durationSeconds": { "type": "number", "minimum": 0 }
      }
    },
    "continuity": {
      "type": "object",
      "additionalProperties": false,
      "properties": {
        "preserveScreenDirection": { "type": "boolean" },
        "matchedEntityIds": { "type": "array", "items": { "type": "string" }, "uniqueItems": true },
        "startState": { "type": "string" },
        "endState": { "type": "string" }
      }
    }
  }
}
