{
  "schema": "STARWARS_DELTA_CUTSCENE_SCRIPT",
  "schemaVersion": 1,
  "title": "Diagnostic Fixture - Intentional Unresolved CURRENT Handle",
  "durationSeconds": 8,
  "creativeIntent": "This file is intentionally schema-valid but CURRENT-invalid. It exists only to prove that the Simple Preview reports unresolved handles clearly and never silently substitutes a visually similar asset.",
  "beats": [
    {
      "id": "S01_missing_asset",
      "type": "threat_reveal",
      "durationSeconds": 8,
      "locationHandle": "moon_8_0__7de24a27",
      "storyClaim": "An intentionally nonexistent ship handle is requested so strict diagnostics can be verified.",
      "visible": [
        {
          "id": "missing_ship",
          "handle": "INTENTIONALLY_MISSING_HANDLE__DO_NOT_SUBSTITUTE",
          "count": 1,
          "role": "diagnostic-only nonexistent asset",
          "state": "unresolved",
          "depth": "mid",
          "screenX": 0.5,
          "screenY": 0.55,
          "screenWidthFraction": 0.2,
          "enterFrom": "reveal",
          "exitTo": "none"
        }
      ],
      "camera": {
        "framing": "wide",
        "movement": "hold",
        "subject": "missing_ship",
        "purpose": "The preview must show UNRESOLVED CURRENT HANDLE and must not pick another ship."
      },
      "evidence": "Expected result is a clear blocker diagnostic. Any substituted visual means the preview failed this fixture."
    }
  ]
}